{
  "schema_version": 1,
  "feature_id": "000-baseline",
  "spec_dir": "specs/000-baseline",
  "branch": "main",
  "phase": "specify",
  "phases_done": ["specify"],
  "owner_agent": "claude-code",
  "host": "dev-184",
  "updated_at": "2026-08-18T12:15:00Z",
  "notes": "Brownfield SDD Phases 1-3 complete in ~/projects/ai-drakon-scaffolder (docs/brownfield-migration-guide.md): P1 sdd-universal-template scaffold + 4 retroactive ADRs (docs/adr/0001-0004) + baseline spec (specs/000-baseline/spec.md). P2: 4 new characterization tests for generateDrakonCode added to existing .lovable/src/lib/codegen/__tests__/codegenApi.test.ts, 7/7 passing, verified on .30 laptop (dev-184 disk 95% full, install blocked there) — found+fixed a real vitest fake-timer/unhandled-rejection race bug along the way. P3: docs/for-agents/agent-fleet.md extracted from MASTER-CONTEXT.md, original archived (not deleted) to docs/handoff/archive/. OPEN DECISION for operator: ~/workspace/ai-drakon-scaffolder is a SEPARATE stale checkout (commit 4c60ef4) that GitNexus indexes and that live FastAPI microservices (architect-agent/drakon-agent/docs-agent, ports 8765-8767) run from — it does NOT see any of this SDD work. Needs a decision: sync workspace/ to projects/ state, symlink, or keep separate on purpose. Phase 4 (debt paydown, arbiter shadow->blocking promotion) not started — deliberately deferred, requires operator judgment per brownfield guide (don't promote arbiter until baseline accuracy established)."
}
